Timestamp,Title,Link
3 Hours Ago,"Apple, Google remove TikTok from stores as app halts service in U.S.",https://www.cnbc.com/2025/01/18/apple-google-remove-tiktok-from-stores-as-app-halts-service-in-us.html
11 Hours Ago,Perplexity AI makes a bid to merge with TikTok U.S.,https://www.cnbc.com/2025/01/18/perplexity-ai-makes-a-bid-to-merge-with-tiktok-us.html
14 Hours Ago,"Solana surges 12% on launch of Trump-themed meme coin, ether falls",https://www.cnbc.com/2025/01/18/crypto-market-today.html
15 Hours Ago,"What to expect from travel prices in 2025, and which spots have the best deals",https://www.cnbc.com/2025/01/18/what-to-expect-from-travel-prices-in-2025.html
16 Hours Ago,Consumer protection agencies at risk in Trump’s second term: What it means for you,https://www.cnbc.com/2025/01/18/how-trumps-second-term-could-mean-the-downfall-of-the-fdic-cfpb.html
17 Hours Ago,Why the gold boom is causing a surge in illegal mining,https://www.cnbc.com/2025/01/18/why-the-gold-boom-is-causing-a-surge-in-illegal-mining.html
